,name,street,town,state,zipcode,annual_rounds,ownership,year_built,green_fees
0,Northwood Golf Club,19400 Hwy 116,Monte Rio,CA,95462,"20,000 (estimated)",Public,1928,$38.00
1,Angeles National Golf Club,9401 Foothill Blvd,Sunland,CA,91040,N/A,Public,2004,$98.00
2,Bailey Creek Golf Course,Durkin Dr,Lake Almanor,CA,96317,N/A,Public,1999,$63.00
3,Friars Presidio Course at Riverwalk Golf Club,1150 Fashion Valley Rd,San Diego,CA,92108,N/A,Resort,1998,$98.00
4,Mission Friars Course at Riverwalk Golf Club,1150 Fashion Valley Rd,San Diego,CA,92108,N/A,Resort,1998,$98.00
5,Presidio Mission Course at Riverwalk Golf Club,1150 Fashion Valley Rd,San Diego,CA,92108,N/A,Resort,N/A,$98.00
6,Forest Lake Golf Course,2450 E Woodson Rd,Acampo,CA,95220,N/A,Public,1941,$12.00
7,Lindero Country Club,5719 Lake Lindero Dr,Agoura Hills,CA,91301,N/A,Semi-Private,1970,$16.00
8,Ranch Course at Sierra Meadows Country Club,46516 Opah Drive,Ahwahnee,CA,93601,N/A,Semi-Private,1980,$49.00
9,River Creek Course at Sierra Meadows Country Club,46516 Opah Drive,Ahwahnee,CA,93601,N/A,Semi-Private,1990,N/A
10,River Creek Golf Course,41709 Rd 600,Ahwahnee,CA,93601,N/A,Public,1990,$22.00
11,The Miff Albright Par 3 Course at Chuck Corica Golf Complex,1 Clubhouse Memorial Dr,Alameda,CA,94502,N/A,Public,1957,N/A
12,The North - Earl Fry Course at Chuck Corica Golf Complex,1 Clubhouse Memorial Dr,Alameda,CA,94502,N/A,Public,1927,$35.00
13,The South - Jack Clark Course at Chuck Corica Golf Complex,1 Clubhouse Memorial Dr,Alameda,CA,94502,N/A,Public,1957,$35.00
14,Round Hill Golf & Country Club,3169 Round Hill Rd,Alamo,CA,94507,"50,000 (estimated)",Private,,$100.00
15,Alhambra Municipal Golf Course,630 S Almansor St,Alhambra,CA,91801,"90,000 (estimated)",Public,1955,$23.50
16,Creek Valley Course at Aliso Viejo Golf Club,25191 Golf Dr,Aliso Viejo,CA,92656,"65,000 (estimated)",Public,1999,$99.00
17,Ridge Creek Course at Aliso Viejo Golf Club,25191 Golf Dr,Aliso Viejo,CA,92656,"65,000 (estimated)",Public,1999,$99.00
18,Valley Ridge Course at Aliso Viejo Golf Club,25191 Golf Dr,Aliso Viejo,CA,92656,"65,000 (estimated)",Public,1999,$99.00
19,Altadena Golf Course,1456 E Mendocino St,Altadena,CA,91001,"70,000 (estimated)",Public,1939,$25.00
20,Arrowhead Golf Course,1901 N Warner St,Alturas,CA,96101,"20,000 (estimated)",Public,1966,$20.00
21,Anaheim Hills Golf Course,6501 E Nohl Ranch Rd,Anaheim,CA,92807,"90,000 (estimated)",Public,1972,$50.00
22,Dad Miller Golf Course,430 N Gilbert St,Anaheim,CA,92801,"115,000 (estimated)",Public,1961,$32.00
23,Greenhorn Creek Resort Golf Course,676 Mccauley Ranch Rd,Angels Camp,CA,95222,"38,000 (estimated)",Semi-Private,1996,$75.00
24,Antelope Greens Golf Course,2721 Elverta Rd,Antelope,CA,95843,"50,000 (estimated)",Public,1994,$21.00
25,Lawrence Links Golf Course,3825 Blackfoot Way,Antelope,CA,95843,"17,000 (estimated)",Public,1962,$20.00
26,Golf Club At Roddy Ranch,1 Tour Way,Antioch,CA,94531,N/A,Public,2000,$75.00
27,Lone Tree Golf Course,4800 Golf Course Rd,Antioch,CA,94509,"80,000 (estimated)",Public,1957,$33.00
28,Apple Valley Country Club,15200 Rancherias Rd,Apple Valley,CA,92307,"25,000 (estimated)",Private,1951,$40.00
29,Jess Ranch Golf Course,10885 Apple Valley Rd,Apple Valley,CA,92308,"52,000 (estimated)",Public,1993,$34.00
30,Seascape Golf Club,610 Clubhouse Dr,Aptos,CA,95003,"70,000 (estimated)",Semi-Private,1900,$80.00
31,Arbuckle Golf Club,Hillgate Rd,Arbuckle,CA,95912,N/A,Semi-Private,1960,$25.00
32,Arcadia Golf Course,620 E Live Oak Ave,Arcadia,CA,91006,"65,000 (estimated)",Public,1959,$12.00
33,Santa Anita Golf Course,405 S Santa Anita Ave,Arcadia,CA,91006,"100,000 (estimated)",Public,1933,$25.00
34,Baywood Golf & Country Club,3600 Buttermilk Ln,Arcata,CA,95521,"30,000 (estimated)",Private,1958,$25.00
35,Meadowmont Golf Course,1684 Hwy 4,Arnold,CA,95223,"16,000 (estimated)",Public,1954,$23.00
36,Sequoia Woods Country Club,1000 Cypress Point Dr,Arnold,CA,95223,"32,000 (estimated)",Private,1963,$35.00
37,Cypress Ridge,780 Cypress Ridge Pkwy,Arroyo Grande,CA,93420,N/A,Public,1999,$65.00
38,Sycamore Canyon Golf Course,500 Kenmar Ln,Arvin,CA,93203,"55,000 (estimated)",Public,1992,$15.00
39,Chalk Mountain Golf Course,10000 El Bordo Rd,Atascadero,CA,93422,"64,000 (estimated)",Public,1980,$27.00
40,Eagle Creek Golf Course,13000 Atascadero Rd,Atascadero,CA,93422,"40,000 (estimated)",Public,1998,$17.00
41,Rancho Del Rey Golf Club,5250 W Green Sands Rd,Atwater,CA,95301,"70,000 (estimated)",Semi-Private,1955,$22.00
42,Auburn Valley Country Club,8800 Auburn Valley Rd,Auburn,CA,95602,"50,000 (estimated)",Private,1958,$60.00
43,Black Oak Golf Course,2455 Black Oak Rd,Auburn,CA,95602,"80,000 (estimated)",Public,1987,$20.00
44,Course at Raspberry Hill,14520 Musso Rd,Auburn,CA,95603,"39,000 (estimated)",Public,1981,$17.50
45,DarkHorse Golf Club,13450 Combie Rd,Auburn,CA,95602,N/A,Public,2002,$79.00
46,Lake of the Pines Country Club,11665 Lakeshore N,Auburn,CA,95602,"50,000 (estimated)",Private,1978,$20.00
47,Ridge Golf Course,2020 Golf Course Rd,Auburn,CA,95602,N/A,Semi-Private,1999,$55.00
48,Catalina Island Golf Club,1 Country Club Rd,Avalon,CA,90704,"35,000 (estimated)",Semi-Private,1925,$48.00
49,Avila Beach Resort,6464 Ana Bay Drive,Avila Beach,CA,93424,"55,000 (estimated)",Resort,1969,$62.00
50,Azusa Greens Country Club,919 W Sierra Madre Ave,Azusa,CA,91702,N/A,Public,1965,$35.00
51,Bakersfield Country Club,4200 Country Club Dr,Bakersfield,CA,93306,"30,000 (estimated)",Private,1949,$100.00
52,James C. Haggerty North Kern Golf Course,17412 Quality Rd,Bakersfield,CA,93308,"60,000 (estimated)",Public,1950,$14.75
53,Kern River Golf Course,Lake Ming Dr,Bakersfield,CA,93386,"72,000 (estimated)",Public,1953,$14.75
54,Links at River Lakes Ranch,5201 Riverlakes Dr,Bakersfield,CA,93312,N/A,Public,1999,$44.00
55,Pepper Tree Golf Course,1119 Watts Dr,Bakersfield,CA,93307,"52,000 (estimated)",Public,1952,$25.00
56,Rio Bravo Country Club,15200 Casa Club Dr,Bakersfield,CA,93306,"42,000 (estimated)",Private,1979,$50.00
57,Seven Oaks Country Club,2000 Grand Lakes Ave,Bakersfield,CA,93311,"40,000 (estimated)",Private,1991,$60.00
58,Stockdale Country Club,7001 Stockdale Hwy,Bakersfield,CA,93309,"40,000 (estimated)",Private,1925,$60.00
59,Sundale Country Club,6218 Sundale Ave,Bakersfield,CA,93309,"50,000 (estimated)",Semi-Private,1962,$30.00
60,Sun Lakes Country Club,850 S Country Club Dr,Banning,CA,92220,"67,000 (estimated)",Semi-Private,1987,$50.00
61,Sun Lakes Country Club Executive Course,545 Twin Hills,Banning,CA,92220,N/A,Semi-Private,1996,$16.00
62,Barstow Country Club,2781 Country Club Dr,Barstow,CA,92311,N/A,Public,1974,$20.00
63,Tees & Trees Golf Course,Nebo Marine Base,Barstow,CA,92311,N/A,Military,1956,$13.00
64,RECCE Point Golf Course,17350 Warren Shingle Blvd,Beale Afb,CA,95903,"30,000 (estimated)",Military,1958,$20.00
65,Champions Course at PGA of Southern California at Oak Valley,36211 Champions Dr,Beaumont,CA,92223,N/A,Public,2000,$75.00
66,Legends Course at PGA of Southern California at Oak Valley,36211 Champions Dr,Beaumont,CA,92223,N/A,Public,2000,$75.00
67,Oak Valley Golf Club,1888 Golf Club Dr,Beaumont,CA,92223,"40,000 (estimated)",Public,1990,$75.00
68,Ford Park Golf Course,8000 Park Ln,Bell Gardens,CA,90201,"47,000 (estimated)",Public,1975,$4.00
69,Tilden Park Golf Course,Grizzley Peak & Shasta Rd,Berkeley,CA,94708,"88,000 (estimated)",Public,1937,$55.00
70,First Nine Second Nine Course at Bermuda Dunes Country Club,42360 Adams St,Bermuda Dunes,CA,92201,"50,000 (estimated)",Private,1960,$80.00
71,Second Nine Third Nine Course at Bermuda Dunes Country Club,42360 Adams St,Bermuda Dunes,CA,92201,"50,000 (estimated)",Private,1986,$80.00
72,Third Nine First Nine Course at Bermuda Dunes Country Club,42360 Adams St,Bermuda Dunes,CA,92201,"50,000 (estimated)",Private,1960,$80.00
73,Bethel Island Club,3303 Gateway Rd,Bethel Island,CA,94511,"80,000 (estimated)",Public,1966,$22.00
74,Big Bear Mountain Golf Course,43100 Goldmine Dr,Big Bear Lake,CA,92315,N/A,Resort,1921,$32.00
75,Bishop Country Club,200 S Hwy 395,Bishop,CA,93514,"55,000 (estimated)",Semi-Private,1963,$32.00
76,Feather River Inn Golf Club & Resort,Hwy 70 At Feather River Inn Rd,Blairsden,CA,96103,"17,000 (estimated)",Resort,1919,$18.00
77,Feather River Park Resort,8339 Hwy 89,Blairsden,CA,96103,N/A,Resort,1923,$18.00
78,Blythe Golf Course,4708 Wells Rd,Blythe,CA,92225,"40,000 (estimated)",Public,1969,$20.00
79,Bodega Harbour Golf Links,21301 Heron Dr,Bodega Bay,CA,94923,"33,000 (estimated)",Semi-Private,1977,$90.00
80,Bonita Golf Club,5540 Sweetwater Rd,Bonita,CA,91902,N/A,Public,1980,$28.00
81,Chula Vista Golf Course,4475 Bonita Rd,Bonita,CA,91902,N/A,Public,1961,$28.00
82,San Luis Rey Downs Golf & Country Club,31474 Golf Club Dr,Bonsall,CA,92003,N/A,Resort,1965,$64.00
83,Club Circle Golf Course,Club Circle,Borrego Springs,CA,92004,N/A,Public,1998,$12.00
84,De Anza Desert Country Club,509 Catarina Dr,Borrego Springs,CA,92004,"27,000 (estimated)",Private,1959,$60.00
85,Desertwillow Course at Borrego Springs Resort & Country Club,1112 Titling T Dr,Borrego Springs,CA,92004,"27,000 (estimated)",Resort,1998,$64.00
86,Mesquite Course at Borrego Springs Resort & Country Club,1112 Titling T Dr,Borrego Springs,CA,92004,"27,000 (estimated)",Resort,1998,$64.00
87,Palms Course at Borrego Springs Resort & Country Club,1112 Titling T Dr,Borrego Springs,CA,92004,"27,000 (estimated)",Resort,1998,$64.00
88,Rams Hill Country Club,1881 Rams Hill Rd,Borrego Springs,CA,92004,"40,000 (estimated)",Semi-Private,1982,N/A
89,Road Runner Club,1010 Palm Canyon Dr,Borrego Springs,CA,92004,"15,000 (estimated)",Semi-Private,1970,$20.00
90,Boulder Creek Golf & Country Club,16901 Big Basin Hwy,Boulder Creek,CA,95006,"60,000 (estimated)",Resort,1961,$40.00
91,Del Rio Country Club,102 E Del Rio Rd,Brawley,CA,92227,N/A,Semi-Private,1926,$35.00
92,Birch Hills Golf Course,2250 E Birch St,Brea,CA,92821,"100,000 (estimated)",Public,1972,$24.00
93,Brea Golf Course,501 W Fir St,Brea,CA,92821,N/A,Public,1957,$18.00
94,Brentwood Lake,N/A,Brentwood,CA,N/A,N/A,Public,,N/A
95,Championship Course at Brentwood Country Club,100 Summerset Dr,Brentwood,CA,94513,N/A,Public,1994,$60.00
96,Deer Ridge Country Club,801 Foothill Drive,Brentwood,CA,94513,"30,000 (estimated)",Semi-Private,2004,$58.00
97,Executive Par 3 Course at Brentwood Country Club,100 Summerset Dr,Brentwood,CA,94513,N/A,Public,1995,$24.00
98,Shadow Lakes Golf Club,401 W Country Club Dr,Brentwood,CA,94513,N/A,Public,2001,$80.00
99,Zaca Creek Golf Course,223 Shadow Mountain Dr,Buellton,CA,93427,N/A,Public,1986,$15.00
100,Buena Park Golf Center,5151 Beach Blvd,Buena Park,CA,90621,N/A,Public,1965,$12.00
101,Lake Valley Course at Los Coyotes Country Club,8888 Los Coyotes Dr,Buena Park,CA,90621,"70,000 (estimated)",Private,1958,$100.00
102,Valley Vista Course at Los Coyotes Country Club,8888 Los Coyotes Dr,Buena Park,CA,90621,"70,000 (estimated)",Private,1958,$100.00
103,Vista Lake Course at Los Coyotes Country Club,8888 Los Coyotes Dr,Buena Park,CA,90621,"70,000 (estimated)",Private,1958,$100.00
104,Lakeside Golf Club,4500 Lakeside Dr,Burbank,CA,91505,"25,000 (estimated)",Private,1924,$65.00
105,Par 3 Course at De Bell Municipal Golf Course,1500 Walnut Ave,Burbank,CA,91501,"100,000 (estimated)",Public,,$6.00
106,Regulation Course at De Bell Municipal Golf Course,1500 Walnut Ave,Burbank,CA,91501,"100,000 (estimated)",Public,1958,$23.00
107,Crystal Springs Golf Course,6650 Golf Course Dr,Burlingame,CA,94010,N/A,Semi-Private,1924,$80.00
108,Discovery Bay Country Club,1475 Clubhouse Dr,Byron,CA,94514,"48,000 (estimated)",Private,1986,$75.00
109,Calabasas Golf & Country Club,4515 Park Entrada,Calabasas,CA,91302,N/A,Private,1968,$85.00
110,Tierra del Sol Golf Club,10300 N Loop Dr,California City,CA,93505,"40,000 (estimated)",Public,1977,$18.00
111,Calimesa Country Club,1300 S 3rd St,Calimesa,CA,92320,"55,000 (estimated)",Public,1959,$23.00
112,Mount Saint Helena Golf Course,Napa County Fairgrounds,Calistoga,CA,94515,"20,000 (estimated)",Public,1952,$18.00
113,Camarillo Springs Golf Course,791 Camarillo Springs Rd,Camarillo,CA,93012,"91,000 (estimated)",Public,1971,$45.00
114,Las Posas Country Club,955 Fairway Dr,Camarillo,CA,93010,"36,000 (estimated)",Private,1958,$70.00
115,Spanish Hills Golf & Country Club,999 Crestview Ave,Camarillo,CA,93010,"40,000 (estimated)",Private,1994,$85.00
116,Sterling Hills Golf Club,901 Sterling Hills Dr,Camarillo,CA,93010,N/A,Public,1999,$44.00
117,Cameron Park Country Club,3201 Royal Dr,Cameron Park,CA,95682,"50,000 (estimated)",Private,1962,$45.00
118,Apple Mountain Golf Resort,3430 N Canyon,Camino,CA,95709,N/A,Public,1997,$60.00
119,Camino Heights Golf Course,3020 Vista Tierra Rd,Camino,CA,95709,N/A,Private,1993,$12.50
120,Par 3 Course at Marine Memorial Golf Course,Marine Corps Base Bldg 18415,Camp Pendleton,CA,92055,"60,000 (estimated)",Military,1980,N/A
121,Regulation Course at Marine Memorial Golf Course,Marine Corps Base Bldg 18415,Camp Pendleton,CA,92055,"60,000 (estimated)",Military,1949,$32.00
122,Canyon Lake Country Club,32001 Railroad Canyon Rd,Canyon Lake,CA,92587,"45,000 (estimated)",Private,1969,$37.50
123,Aviara Golf Club,7447 Batiquitos Dr,Carlsbad,CA,92009,"47,000 (estimated)",Resort,1991,$175.00
124,North Course at La Costa Resort & Spa,2100 Costa Del Mar Rd,Carlsbad,CA,92009,"65,000 (estimated)",Resort,1964,$195.00
125,Rancho Carlsbad Country Club,5200 El Camino Real,Carlsbad,CA,92008,N/A,Public,1965,$14.50
126,South Course at La Costa Resort & Spa,2100 Costa Del Mar Rd,Carlsbad,CA,92009,"65,000 (estimated)",Resort,1964,$195.00
127,Carmel Valley Ranch Resort,One Old Ranch Rd,Carmel,CA,93923,"48,000 (estimated)",Resort,1980,$175.00
128,East Course at Rancho Canada Golf Club,4860 Carmel Valley Rd,Carmel,CA,93922,"120,000 (estimated)",Public,1970,$60.00
129,Preserve Golf Club,19 Pronghorn Run,Carmel,CA,93923,"9,000 (estimated)",Private,2000,$75.00
130,Quail Lodge Resort & Golf Club,8205 Valley Greens Dr,Carmel,CA,93923,"35,000 (estimated)",Resort,1963,$165.00
131,West Course at Rancho Canada Golf Club,4860 Carmel Valley Rd,Carmel,CA,93922,"120,000 (estimated)",Public,1970,$75.00
132,Tehama Golf Club,101 Via Malpaso,Carmel Valley,CA,93923,N/A,Private,1999,N/A
133,Ancil Hoffman Golf Course,6700 Tarshes Dr,Carmichael,CA,95608,N/A,Public,1965,$25.00
134,Dominguez Golf & Practice Center,19800 S Main St,Carson,CA,90745,"60,000 (estimated)",Public,1960,$11.00
135,Victoria Golf Course,340 E 192nd St,Carson,CA,90746,"75,000 (estimated)",Public,1962,$25.00
136,Willow Park Golf Course,17007 Redwood Rd,Castro Valley,CA,94546,"95,000 (estimated)",Public,1966,$30.00
137,Arroyo Lake Course at Cathedral Canyon Country Club,34567 Cathedral Canyon Dr,Cathedral City,CA,92234,"65,000 (estimated)",Resort,1990,$70.00
138,Date Palm Springs Country Club,36200 Date Palm Dr,Cathedral City,CA,92234,N/A,Semi-Private,1970,$45.00
139,Eighteen Hole Executive Course at Outdoor Resort & Country Club,69411 Ramon Rd,Cathedral City,CA,92234,N/A,Private,1975,$18.00
140,El Cielo La Vista Course at Desert Princess Country Club,28555 Landau Blvd,Cathedral City,CA,92234,N/A,Private,1984,$120.00
141,La Vista Los Lagos Course at Desert Princess Country Club,28555 Landau Blvd,Cathedral City,CA,92234,N/A,Private,1984,$120.00
142,Lake Mountian Course at Cathedral Canyon Country Club,34567 Cathedral Canyon Dr,Cathedral City,CA,92234,"65,000 (estimated)",Resort,1975,$70.00
143,Long Course at Cimarron Golf Club,67-603 30th Ave,Cathedral City,CA,92234,N/A,Public,1999,$115.00
144,Los Lagos El Cielo Course at Desert Princess Country Club,28555 Landau Blvd,Cathedral City,CA,92234,N/A,Private,1984,$120.00
145,Mountain Arroyo Course at Cathedral Canyon Country Club,34567 Cathedral Canyon Dr,Cathedral City,CA,92234,"65,000 (estimated)",Resort,1990,$70.00
146,Nine Hole Course at Outdoor Resort & Country Club,69411 Ramon Rd,Cathedral City,CA,92234,N/A,Private,1980,$8.00
147,Short Course at Cimarron Golf Club,67-603 30th Ave,Cathedral City,CA,92234,N/A,Public,1999,$55.00
148,River Oaks Golf Course,3441 E Hatch Rd,Ceres,CA,95307,N/A,Public,1979,$14.00
149,Cerritos Iron-Wood Nine Golf Course,16449 Piuma Ave,Cerritos,CA,90703,"48,000 (estimated)",Public,1976,$16.00
150,Highland Springs Village Golf Club,10370 Overland Trl,Cherry Valley,CA,92223,N/A,Private,,$8.00
151,Lake Almanor West Golf Course,111 Slim Dr,Chester,CA,96020,"26,000 (estimated)",Public,1974,$30.00
152,Bidwell Park Golf Course,3199 Golf Course Rd,Chico,CA,95973,"60,000 (estimated)",Public,1935,$22.00
153,Butte Creek Country Club,175 Estates Dr,Chico,CA,95928,"30,000 (estimated)",Private,1965,$75.00
154,Canyon Oaks Country Club,999 Yosemite Dr,Chico,CA,95928,"40,000 (estimated)",Private,1990,$45.00
155,Sunset Hills Golf Course,13301 Garner Ln,Chico,CA,95973,"30,000 (estimated)",Public,1954,$12.00
156,Butterfield Stage Course at El Prado Golf Courses,6555 Pine Ave,Chino,CA,91710,"120,000 (estimated)",Public,1976,$34.00
157,Chino Creek Course at El Prado Golf Courses,6555 Pine Ave,Chino,CA,91710,"120,000 (estimated)",Public,1970,$34.00
158,Chino Hills Golf Club,N/A,Chino Hills,CA,N/A,N/A,N/A,,N/A
159,North Course at Los Serranos Golf & Country Club,15656 Yorba Ave,Chino Hills,CA,91709,"140,000 (estimated)",Public,1925,$55.00
160,South Course at Los Serranos Golf & Country Club,15656 Yorba Ave,Chino Hills,CA,91709,"140,000 (estimated)",Public,1960,$65.00
161,Western Hills Golf & Country Club,1800 Carbon Canyon Rd,Chino Hills,CA,91709,"40,000 (estimated)",Private,1963,$60.00
162,Pheasant Run Golf Course,19 Clubhouse Dr,Chowchilla,CA,93610,"41,600 (estimated)",Public,1998,$33.00
163,Auld Course,525 Hunte Pkwy,Chula Vista,CA,91915,"45,000 (estimated)",Public,2001,$78.00
164,Eastlake Country Club,2375 Clubhouse Dr,Chula Vista,CA,91915,N/A,Public,1991,$65.00
165,San Diego Country Club,88 L St,Chula Vista,CA,91911,"50,000 (estimated)",Private,1920,$60.00
166,Sunrise Golf Course,6412 Sunrise Blvd,Citrus Heights,CA,95610,"25,000 (estimated)",Private,1970,$15.00
167,Babe Didrikson Zaharias Course,One Industry Hills Pkwy,City Of Industry,CA,91744,"150,000 (estimated)",Resort,1979,$93.00
168,Dwight D. Eisenhower Course at Industry Hills Pacific Palms Resort,One Industry Hills Pkwy,City Of Industry,CA,91744,"150,000 (estimated)",Resort,1979,$93.00
169,Claremont Golf Course,1550 N Indian Hill Blvd,Claremont,CA,91711,"55,000 (estimated)",Public,1959,$17.00
170,Oakhurst Country Club,1001peacock Creek Dr,Clayton,CA,94517,"54,000 (estimated)",Private,1990,$80.00
171,Dragon at Gold Mountain,3887 County Rd A-15,Clio,CA,96106,N/A,Resort,1998,$139.00
172,Dragon Golf Course,348 Bear Run,Clio,CA,96106,"20,000 (estimated)",Resort,2000,$120.00
173,Golf Club at Whitehawk Ranch,768 Whitehawk Drive,Clio,CA,96106,"20,000 (estimated)",Resort,1996,$140.00
174,Lonesome Dove Golf Course,41605 S Sutter Rd,Coalinga,CA,93210,"22,000 (estimated)",Public,1937,$14.00
175,Yosemite Lakes Park Golf Course,30250 Yosemite Springs Ct,Coarsegold,CA,93614,N/A,Private,1965,$12.00
176,Adam Springs Golf Course,14347 Snead Court,Cobb,CA,95426,"22,000 (estimated)",Semi-Private,1963,$20.00
177,Hobergs Forest Lake Golf Course,10200 Golf Rd,Cobb,CA,95426,N/A,Public,1953,$20.00
178,Cypress Golf Course,2001 Hillside Blvd,Colma,CA,94014,"40,000 (estimated)",Public,1963,N/A
179,Colton Golf Club,1901 Valley Blvd,Colton,CA,92324,"70,000 (estimated)",Public,1963,$17.00
180,Colusa Golf & Country Club,2224 Hwy 20,Colusa,CA,95932,N/A,Semi-Private,1956,$20.00
181,Compton Par 3 Golf Course,6400 E Compton Blvd,Compton,CA,90221,N/A,Public,1958,$7.50
182,Buchanan Fields Golf Course,1091 Concord Ave,Concord,CA,94520,"26,500 (estimated)",Public,1955,$18.00
183,Diablo Creek Golf Course,4050 Port Chicago Hwy,Concord,CA,94520,N/A,Public,1963,$23.00
184,Auburn Lake Trails Golf Course,2277 Westville Trl,Cool,CA,95614,N/A,Private,1974,$15.00
185,Saddle Creek Golf Club,1001 Saddle Creek Dr,Copperopolis,CA,95228,"34,000 (estimated)",Semi-Private,1996,$90.00
186,Cresta Verde Golf Club,1295 Cresta Rd,Corona,CA,92879,"46,000 (estimated)",Public,1926,$39.00
187,Eagle Glen Golf Club,1800 Eagle Glen Pkwy,Corona,CA,92883,"53,000 (estimated)",Public,1999,$105.00
188,Mountain View Country Club,2121 Mountain View Dr,Corona,CA,92882,"65,000 (estimated)",Public,1962,$39.00
189,Orange Course at Green River Golf Club,5215 Green River Rd,Corona,CA,92880,"200,000 (estimated)",Public,1959,$40.00
190,Riverside Course at Green River Golf Club,5215 Green River Rd,Corona,CA,92880,"200,000 (estimated)",Public,1992,$40.00
191,Coronado Golf Course,2000 Visalia Row,Coronado,CA,92118,"120,000 (estimated)",Public,1957,$25.00
192,Los Lagos Course at Costa Mesa Golf & Country Club,1701 Golf Course Dr,Costa Mesa,CA,92626,N/A,Public,1968,$33.00
193,Mesa Linda Course at Costa Mesa Golf & Country Club,1701 Golf Course Dr,Costa Mesa,CA,92626,N/A,Public,1968,$25.00
194,Mesa Verde Country Club,3000 Club House Rd,Costa Mesa,CA,92626,"51,000 (estimated)",Private,1959,$90.00
195,North Course at Coto de Caza Golf & Racquet Club,25291 Vista Del Verde,Coto De Caza,CA,92679,"40,000 (estimated)",Private,1987,$100.00
196,South Course at Coto de Caza Golf & Racquet Club,25291 Vista Del Verde,Coto De Caza,CA,92679,"40,000 (estimated)",Private,1995,$100.00
197,Tournament Course at Coyote Creek,Hwy 101,Coyote,CA,95013,"70,000 (estimated)",Public,1999,$110.00
198,Valley Course at Coyote Creek,Hwy 101,Coyote,CA,95013,"70,000 (estimated)",Public,2001,$59.00
199,Del Norte Golf Club,130 Club Dr,Crescent City,CA,95531,N/A,Semi-Private,1953,$18.00
200,Kings Valley Golf Course,3030 Lesina Rd,Crescent City,CA,95531,N/A,Public,1965,$11.00
201,Mount Huff Golf Course,Arlington Rd & Hwy 89,Crescent Mills,CA,95934,"17,000 (estimated)",Public,1974,$16.00
202,Blackberry Farm Golf Course,22100 Stevens Creek Blvd,Cupertino,CA,95014,"80,000 (estimated)",Public,1962,$22.00
203,Deep Cliff Golf Course,10700 Club House Ln,Cupertino,CA,95014,"90,000 (estimated)",Public,1961,$33.00
204,Cruiser Course at Seal Beach Navy Golf Course,5660 Orangewood Ave,Cypress,CA,90630,"112,000 (estimated)",Military,1970,$12.00
205,Destroyer Course at Seal Beach Navy Golf Course,5660 Orangewood Ave,Cypress,CA,90630,"112,000 (estimated)",Military,1970,$30.00
206,Lake Merced Golf Club,2300 Junipero Sierra Blvd,Daly City,CA,94015,"35,000 (estimated)",Private,1922,$200.00
207,Monarch Beach Golf Links,22 Monarch Beach Resort Dr. N.,Dana Point,CA,92629,"50,000 (estimated)",Resort,1984,$200.00
208,Crow Canyon Country Club,711 Silver Lake Dr,Danville,CA,94526,"70,000 (estimated)",Private,1976,$75.00
209,Falls Course at Blackhawk Country Club,599 Blackhawk Club Dr,Danville,CA,94506,"70,000 (estimated)",Private,1988,$75.00
210,Lakeside Course at Blackhawk Country Club,599 Blackhawk Club Dr,Danville,CA,94506,"70,000 (estimated)",Private,1982,$90.00
211,Davis Golf Course,24439 Fairway Dr,Davis,CA,95616,N/A,Public,1964,$15.00
212,Wildhorse Golf Course,2323 Rockwell,Davis,CA,95616,N/A,Public,1998,$45.00
213,Furnace Creek Inn & Ranch Resort,1 Furnace Creek Blvd,Death Valley,CA,92328,"23,000 (estimated)",Resort,1927,$50.00
214,Delano Golf Course,104 S Lexington St,Delano,CA,93215,"30,000 (estimated)",Public,1960,$10.00
215,Lake Tamarisk Golf Course,26-251 Parkview Dr,Desert Center,CA,92239,N/A,Semi-Private,1968,$16.00
216,Desert Crest Country Club,69400 S Country Club Dr,Desert Hot Springs,CA,92241,N/A,Semi-Private,1967,$11.00
217,Desert Dunes Golf Course,19300 Palm Dr,Desert Hot Springs,CA,92240,"44,000 (estimated)",Public,1989,$115.00
218,Mission Lakes Country Club,8484 Clubhouse Blvd,Desert Hot Springs,CA,92240,"22,000 (estimated)",Semi-Private,1972,$75.00
219,Sands RV Resort,16400 Bubbling Wells Rd,Desert Hot Springs,CA,92240,N/A,Public,1984,$17.00
220,Diablo Country Club,1 Clubhouse Rd,Diablo,CA,94528,"42,000 (estimated)",Private,1914,$120.00
221,Diamond Bar Golf Course,22751 E Golden Springs Dr,Diamond Bar,CA,91765,"110,000 (estimated)",Public,1964,$25.00
222,Dove Canyon Country Club,22682 Golf Club Dr,Dove Canyon,CA,92679,"45,000 (estimated)",Private,1991,$110.00
223,Los Amigos Country Club,7295 E Quill Dr,Downey,CA,90242,"135,000 (estimated)",Public,1966,$25.00
224,Rio Hondo Golf Club,10627 Old River School Rd,Downey,CA,90241,"100,000 (estimated)",Public,1924,$40.00
225,Rancho Duarte Golf Club,1000 Las Lomas Rd,Duarte,CA,91010,"70,000 (estimated)",Public,1982,$23.00
226,Dublin Ranch Golf Club,5900 Signal Hill Dr,Dublin,CA,94568,N/A,Public,2004,$65.00
227,Campers Inn Golf Course,Rd 88,Dunnigan,CA,95937,N/A,Public,1989,$12.00
228,Muroc Lake Golf Course,Edwards Afb,Edwards,CA,93523,"30,000 (estimated)",Military,,$20.00
229,Ivanhoe Course at Cottonwood at Rancho San Diego,3121 Willow Glen Dr,El Cajon,CA,92019,"120,000 (estimated)",Public,1953,$45.00
230,Monte Vista Course at Cottonwood at Rancho San Diego,3121 Willow Glen Dr,El Cajon,CA,92019,"120,000 (estimated)",Public,1953,$42.00
231,Oak Glen Course at Singing Hills Country Club At Sycuan,3007 Dehesa Rd,El Cajon,CA,92019,"200,000 (estimated)",Resort,1956,$42.00
232,Pine Glen Course at Singing Hills Country Club At Sycuan,3007 Dehesa Rd,El Cajon,CA,92019,"200,000 (estimated)",Resort,1950,$14.00
233,Willow Glen Course at Singing Hills Country Club At Sycuan,3007 Dehesa Rd,El Cajon,CA,92019,"200,000 (estimated)",Resort,1967,$42.00
234,Broken Spoke Country Club,225 Wake Ave,El Centro,CA,92243,"30,000 (estimated)",Public,1986,$14.00
235,Lakeview Golf Course,1589 Drew Rd,El Centro,CA,92243,"35,000 (estimated)",Public,1990,$10.00
236,Mira Vista Golf & Country Club,7901 Cutting Blvd,El Cerrito,CA,94530,"40,000 (estimated)",Private,1921,$65.00
237,El Dorado Hills Golf Course,3775 El Dorado Hills Blvd,El Dorado Hills,CA,95762,N/A,Public,1964,$22.00
238,Serrano Country Club,5005 Serrano Pkwy,El Dorado Hills,CA,95762,N/A,Private,1996,$80.00
239,El Macero Country Club,44571 Clubhouse Dr,El Macero,CA,95618,"35,000 (estimated)",Private,1961,$60.00
240,Lakes at El Segundo,400 S Sepulveda Blvd,El Segundo,CA,90245,N/A,Public,1994,$16.00
